"B1 sentence","OR-B1 transformation","OR sentence"
"In der spanischen Region Katalonien haben im Jahr 2017 viele Menschen bei einer Abstimmung für die Unabhängigkeit von Spanien gestimmt.","Insert complementary info ",""
"Die damalige Regierung von Spanien erkannte die Abstimmung nicht an und entließ viele katalanische Politiker.","Insert complementary info ",""
"Dadurch wurde der Streit zwischen Spanien und Katalonien noch stärker.","Insert complementary info ",""
"Premier-Minister von Spanien ist nun Pedro Sanchez.","Insert complementary info ",""
"Er will den Streit mit Katalonien beenden.","Complex split ","Nach einem Treffen in Barcelona kündigten Spaniens Ministerpräsident Pedro Sanchez und der katalanische Regionalpräsidenten Quim Torra am Donnerstagabend an, sie seien entschlossen, einen Ausweg aus der Krise zu finden. "
"Darauf hat sich Sanchez mit dem Präsidenten der Region Katalonien geeinigt.","Complex split ","Nach einem Treffen in Barcelona kündigten Spaniens Ministerpräsident Pedro Sanchez und der katalanische Regionalpräsidenten Quim Torra am Donnerstagabend an, sie seien entschlossen, einen Ausweg aus der Krise zu finden. "
"Heuer bekam Spanien eine neue Regierung.","Implicit ","Damals hatte der seit Juni amtierende Sanchez Torra in Madrid empfangen. "
