"B1 sentence","OR-B1 transformation","OR sentence"
"2015 ist eine Rakete der Firma SpaceX ins All gestartet.","Drop extra info ","Ein Teil einer SpaceX-Rakete könnte nach Berechnungen von Wissenschaftern der US-Raumfahrtbehörde NASA Anfang März mit dem Mond zusammenstoßen. Die Rakete war 2015 vom Weltraumbahnhof Cape Canaveral gestartet und hatte das ""Deep Space Climate Observatory"", einen Erdbeobachtungssatelliten, ins All gebracht. "
"Der Treibstoff der Rakete reichte aber nicht mehr aus um zur Erde zurückzukehren, weshalb sie seither im All unterwegs ist.","Paraphrase ","Danach reichte jedoch der Treibstoff der Raketenstufe nicht aus, um zurück zur Erde zu kommen, weswegen sie seitdem im All unterwegs ist. "
"Laut Berechnung der US-Weltraumbehörde NASA könnte nun Anfang März ein Teil der Rakete in den Mond krachen.","Paraphrase ","Ein Teil einer SpaceX-Rakete könnte nach Berechnungen von Wissenschaftern der US-Raumfahrtbehörde NASA Anfang März mit dem Mond zusammenstoßen. "
"Das gab die NASA am Donnerstag bekannt.","Drop extra info ","Die Flugbahn der ""Falcon 9""-Raketenstufe werde derzeit beobachtet, sagte eine NASA-Sprecherin am Donnerstag der Deutschen Presse-Agentur. "
"Der Aufprall wird nicht live beobachtet werden können.","Drop extra info ","Der Aufprall werde von der Sonde ""Lunar Reconnaissance Orbiter"" nicht live beobachtet werden können, hieß es von der NASA. "
"Allerdings wird untersucht werden, ob danach Veränderungen auf dem Mond erkennbar sind.","Drop extra info ","Es werde aber untersucht, ob danach Veränderungen auf dem Mond und ein möglicher durch den Aufprall entstandener Krater analysiert werden könnten. "
"Die Suche nach dem Krater könnte aber Wochen bis Monate dauern.","Drop extra info ","Die Suche nach dem Krater werde eine große Herausforderung und könne Wochen oder sogar Monate dauern. "
