"A2 sentence","B1-A2 transformation","B1 sentence"
"US-Präsident Donald Trump will tausende US-Soldaten aus dem Land Syrien zurück holen.","Insert complementary info ","Trump will Tausende US-Soldaten aus dem Land Syrien zurück holen. "
"Trump denkt nämlich, dass die Terror-Organisation Islamischer Staat (IS) in Syrien besiegt ist.","Paraphrase ","Trump denkt nämlich, dass die Terror-Organisation Islamischer Staat (IS) dort endgültig besiegt ist. "
"Mattis wird am Ende vom Februar 2019 als Verteidigungs-Minister kündigen.","Paraphrase ","Der Verteidigungs-Minister der USA James Mattis tritt Ende Februar zurück. "
"Deshalb will Mattis nicht mehr der Verteidigungs-Minister sein.","Implicit ","Als Grund dafür gab er an, dass er große Meinungs-Verschiedenheiten mit US-Präsident Donald Trump hat. "
"Der Verteidigungs-Minister der USA James Mattis denkt aber, dass der IS nicht besiegt ist.","Implicit ","Viele Experten und auch Mattis sind anderer Meinung. "
"Mattis findet: Es ist ein Fehler, dass man die US-Soldaten zurück holt.","Insert complementary info ",""
