"A2 sentence","B1-A2 transformation","B1 sentence"
"In Österreich sind die Energie-Preise im letzten Jahr stark gestiegen.","Complex split ","Energiepreise wurden für die österreichischen Haushalte im letzten Jahr viel teurer. "
"Im Dezember 2021 kostete Energie um rund 1 Viertel mehr als noch vor einem Jahr.","Paraphrase ","Im Dezember 2021 war Energie insgesamt um 24,1 Prozent teurer als ein Jahr davor. "
"Besonders Heizöl, Benzin und Diesel kosten viel mehr.","Drop extra info ","Heizöl kostete sogar um 44,3 Prozent mehr, Diesel wurde um 33,9 Prozent teurer und Superbenzin um 31,3 Prozent. "
"Auch Gas und Strom kosteten deutlich mehr und werden wahrscheinlich noch teurer werden.","Join ","Der Preis für Erdgas stieg um 27,7 Prozent, und für Strom musste man um 12,4 Prozent mehr bezahlen. "
"Deshalb müssen auch die Haushalte in Österreich mehr für die Energie bezahlen.","Complex split ","Energiepreise wurden für die österreichischen Haushalte im letzten Jahr viel teurer. "
