"A2 sentence","B1-A2 transformation","B1 sentence"
"In Österreich soll es ab Februar eine Corona-Impf-Pflicht geben.","Paraphrase ","Ab Februar soll es in Österreich eine Corona-Impfpflicht geben. "
"Die Polizei soll dann kontrollieren, ob die Menschen sich daran halten.","Paraphrase ","Ab Mitte März soll die Polizei kontrollieren, ob man geimpft ist oder nicht. "
"Polizei-Gewerkschafter von den Parteien SPÖ und der FPÖ wollen das aber nicht.","Paraphrase ","Polizei-Gewerkschafter von der SPÖ und der FPÖ kritisieren diese Pläne aber. "
"Sie sagen, dass die Gesundheits-Behörden diese Kontrollen machen sollen.","Drop extra info ","Sie verlangen, dass Beamte der Gesundheitsämter die Kontrollen durchführen und nicht die Polizei. "
"Gesundheits-Minister Wolfgang Mückstein will aber, dass die Polizei die Kontrollen macht.","Paraphrase ","Gesundheitsminister Wolfgang Mückstein will aber, dass die Polizei die Impf-Kontrollen durchführt. "
